[
  {
    "schema_version": "1.0.0",
    "id": "WEP-C01",
    "status": "CANDIDATE",
    "created_at": "2026-10-31T00:00:00Z",
    "topic_id": "WEP-01",
    "source_node_id": "WPE-N01",
    "operation": "RETRIEVE",
    "band": "D3",
    "grade_track": "G9_FOUNDATION",
    "blueprint_id": "PHYSICS-D3D4",
    "blueprint_version": "0.2.0-CANDIDATE",
    "adapter_id": "WPE-PILOT",
    "adapter_version": "0.1.0-CANDIDATE",
    "signature": {
      "inputs": [
        "force direction",
        "displacement direction"
      ],
      "obstacle": "Magnitude alone does not determine sign",
      "decisive_move": "Project force and classify sign",
      "output": "Classification with condition",
      "independent_check": "Test perpendicular case",
      "assumptions": [
        "Constant force"
      ],
      "direction": "CLASSIFY_FROM_CASE"
    },
    "prerequisite_ids": [],
    "warrant_ids": [
      "WARR-N01"
    ],
    "source_ids": [
      "SOURCE-N01"
    ],
    "demand_scores": {
      "conceptual": 2,
      "representation": 1,
      "reasoning_chain": 1,
      "algebraic": 1,
      "misconception_trap": 1
    },
    "demand_evidence": {
      "conceptual": "Compare force components",
      "representation": "Interpret directions",
      "reasoning_chain": "Check applicability then project force",
      "algebraic": "Calculate projection sign",
      "misconception_trap": "Perpendicular force may give zero work"
    },
    "decisive_move_evidence": "Candidate six-point rubric; independent cognitive review pending",
    "lesson_ids": [
      "LESSON-A01"
    ],
    "assessment_ids": [
      "TEST-Q01"
    ]
  }
]
